company,category,url,source,policy_date,scraped_at,word_count,sentence_count,section_count,section_headings,grade_level,reading_ease,readability_label,consent_model,opt_in_phrase_count,opt_out_phrase_count,third_party_detected,third_party_mentions,retention_stated,retention_mentions,cat_location,cat_financial,cat_biometric,cat_browsing_device,cat_contact_id,cat_behavioral,cat_communications,total_categories,hits_location,hits_financial,hits_biometric,hits_browsing_device,hits_contact_id,hits_behavioral,hits_communications
Acxiom,Data Broker,https://www.acxiom.com/privacy/international-privacy-notice/#rights,live,Unknown,2026-05-16T10:19:13Z,2447,98,32,"Acxiom International Privacy Notice|Who We Are|Acxiom Consumer International Rights Portal|Consumer Care Advocate|Conway, AR, USA 72033|AskPrivacy@acxiom.com|AskPrivacy@acxiom.com|Acxiom’s Business|Personal Information Collection and Use|Insight|Recognition|Contact|Additional Terms and Conditions|Offshoring|Opt-Out from Acxiom’s Marketing Products:|Attention:  International – Privacy Rights Requests|Access and Deletion|Acxiom Consumer Privacy Support Portal|Attention:  International Complaints|Legitimate Interests|Data Transfers|Data Retention|INSIGHT|RECOGNITION|CONTACT|Third Party Opt-Outs|AskPrivacy@acxiom.com|Accuracy|Safeguards|Compliance|Awareness|Privacy Policy Changes",14.6,27.4,College level — challenging for average user,Primarily Opt-Out,0,1,True,6,True,6,True,True,False,False,True,True,True,5,8,3,0,0,7,4,1
Experian,Data Broker,https://www.experian.com/privacy/us-consumer-data-privacy-policy,live,"April 8, 2026",2026-05-16T10:23:10Z,2283,89,14,Introduction|1. Scope of Privacy Policy|Click|Digital Advertising Alliance Opt-Out|4. Privacy Rights Regarding Personal Information|How to Exercise Your Rights|Authorized Agent|Opt-Out Preference Signals|Experian as a Processor/Service Provider|6. How Long We Keep Personal Information|Data Collection of Minors’ Data|8. Annual User Rights Request Metrics|9. Contact for More Information|Email,13.3,34.2,College level — challenging for average user,Primarily Opt-Out,0,2,True,1,True,1,False,False,False,True,True,False,False,2,0,0,0,1,6,0,0
Equifax,Data Broker,https://www.equifax.com/privacy/privacy-statement/,live,Unknown,2026-05-16T10:29:01Z,2373,72,34,"Introduction|Your Privacy Choices|Categories of Personal Information Collected|Identifiers|Employers|Education|Employers|Employers|Commercial Information|Employers|Biometric Information|Employers|Sensory Data|Employers|Employers|Behavior|Employers|Sensitive Personal Information|Employers|Purpose and Use of Personal Information Collected|Disclosing your Personal Information|Rights of California Residents|Correction|Deletion|Opt-Out|Your Privacy Choices|Authorized Agent|Authorized Agent Form|Authorized Agent Form|Equifax Information Services LLC|Individual Rights Requests Metrics Reporting|Median Days to Complete|,732,143|Right to Limit Use",16.3,11.8,Graduate level — likely inaccessible to most users,Primarily Opt-Out,0,1,True,14,True,2,True,True,True,True,True,True,True,7,5,8,4,2,12,7,3
TransUnion,Data Broker,https://www.transunion.com/privacy/consumer-privacy-policy,fallback,Unknown,2026-05-16T10:54:03Z,5677,135,54,Introduction|Sontiq Privacy Center|Argus Privacy Notice|Commerce Signals Privacy Notice|Analytics Disclosure|Cookies and Similar Technologies Notice|Consumer Privacy Rights|Notice at Collection|1. Personal information we collect|Category of Personal Information|Identifiers|TransUnion Companies|Advertising Partners|TransUnion Companies|Employer Information|2. Purpose for collecting and use of personal information|Category of Personal Information|Category of Personal Information|Banks/Credit Unions|TransUnion Companies|Banks/Credit Unions|TransUnion Companies|TransUnion Companies|TransUnion Companies|TransUnion Companies|TransUnion Companies|TransUnion Companies|TransUnion Companies|TransUnion Companies|TransUnion Companies|TransUnion Companies|TransUnion Companies|TransUnion Companies|4. Privacy rights and choices|Consumer Privacy Rights|Your Privacy Choices|Cookies Settings|5. Privacy requests via authorized agent|Consumer Privacy Rights|Consumer Privacy Rights|TransUnion Data Privacy|Rights under the Fair Credit Reporting Act (FCRA)|Summary of FCRA Rights|TransUnion Personal Credit Report|Child Identity Theft Inquiry|Protected Consumer Freeze|7. Personal information of children|Your Privacy Choices|8. Securing personal information|9. Retaining personal information|10. Corporate reorganization|11. Links to other sites or services|12. Contact information|13. Notice changes and effective date,18.4,0.0,Graduate level — likely inaccessible to most users,Mixed,1,3,True,29,True,10,True,True,True,True,True,True,True,7,13,13,6,26,25,15,1
LiveRamp,Data Broker,https://liveramp.com/privacy/,live,Unknown,2026-05-16T10:54:57Z,331,13,10,"Introduction|Read our Privacy Notices|Security|Data Security Knowledge Base page|Your Privacy Choices|Select the appropriate link below to exercise your rights|Australia Your Rights portal|EEA Countries|The UK Your Rights Portal,|France Your Rights Portal",13.7,27.5,College level — challenging for average user,Unclear,0,0,True,1,False,0,True,False,False,False,False,True,False,2,1,0,0,0,0,1,0
The Trade Desk,Data Broker,https://www.thetradedesk.com/us/privacy,live,"March 13, 2026",2026-05-16T11:32:50Z,5042,197,46,"Introduction|UID2 Administrator Privacy Policy,|EUID Privacy Notice|YOUR RIGHTS AND CHOICES|Overview|Network Advertising Initiative|Digital Advertising Alliance|Digital Advertising Alliance of Canada|European Digital Advertising Alliance|Opt Out|At A Glance|Who we are|What we do|Pseudonymous data such as|Some of the ways the Platform collects data include|The purposes for which the Platform processes data|We disclose data to other parties such as|Security and Data Retention|Your rights and choices|Full Privacy Policy|THE PLATFORM|THE DATA THE PLATFORM COLLECTS AND PROCESSES|HOW THE PLATFORM COLLECTS DATA|COOKIES|THE PURPOSES FOR WHICH THE PLATFORM PROCESSES DATA|TARGETED ADVERTISING|PERSONALISATION AND INTERESTS|DISCLOSURE AND TRANSFER|We transfer data to the US under valid transfer mechanisms|SECURITY AND DATA RETENTION|YOUR RIGHTS AND CHOICES|CALIFORNIA PRIVACY INFORMATION|Category of Personal Data|Uses|Recipients|Identifiers|Internet and Electronic Network Information|Inferences|Other Parties|Privacy Rights|Annual Data Requests|CHANGES TO OUR POLICIES|CONTACT US|Mail|N. Chestnut St.|Email",12.5,40.6,College level — challenging for average user,Primarily Opt-Out,0,3,True,10,True,3,True,True,False,True,True,True,False,5,26,2,0,11,12,22,0
Uber,Platform,https://www.uber.com/legal/en/document/?name=privacy-policy,fallback,Unknown,2026-05-16T11:33:27Z,785,27,3,Introduction|Standard Contractual Clauses|DPF Principles,12.9,35.8,College level — challenging for average user,Unclear,0,0,False,0,False,0,False,False,False,False,False,False,False,0,0,0,0,0,0,0,0
Airbnb,Platform,https://www.airbnb.com.sg/help/article/3175?_set_bev_on_new_domain=1777688869_EAOGRiMjE3YTZlMT&set_everest_cookie_on_new_domain=1777688869.EAYzk2YjU3YjJlZDRkZm.X3yA4Ka8Hgna7fzUGDRxrHYXugABNcTpi4pc9B7b5i0,live,Unknown,2026-05-16T11:36:47Z,1632,71,37,"Personal Information Needed to Use the Airbnb Platform.|1 Contact, Account, and Profile Information.|2 Identity Information.|3 Payment Transaction Information.|4 Guest Insurance Information.|Insurance|5 Host Insurance Information.|6 License Information.|7 Online Profiles and Relevant Experience.|8 Background Screenings.|Personal Information You Choose to Give Us.|1 Additional Profile Information.|2 Information About Others.|3 Biometric Information.|4 Communications Information.|5 User-Generated Content.|6 Support Information.|7 Business Information.|8 Preferences and Requirements.|9 Information Required to Use the Airbnb Community Network.|10 Other Information.|1 Geolocation Information.|2 Usage Information.|3 Device Information.|Cookie Policy|Personal Information We Collect from Third Parties.|1 Third-Party Applications.|2 License Verification and Background Information Providers.|3 Enterprise Product Invitations and Account Management.|4 Referrals and Co-Travelers.|5 Complainants.|6 Financial Institutions.|7 Flexible Payment Plans and Financing Providers.|8 Building Management.|Building Management|9 Corporate Affiliates.|10 Other Sources.",13.5,39.2,College level — challenging for average user,Primarily Opt-In,1,0,True,9,False,0,True,True,True,True,True,True,True,7,8,20,3,4,16,14,3
